{
  "name": "loopdef-iteration",
  "version": 1,
  "description": "Fixed-iteration loop terminated by an integer bound.",
  "roles": [
    { "name": "work", "role": "coder", "prompt": "Do one increment of work toward the goal.", "order": 0 }
  ],
  "termination_condition": { "type": "iteration_bound", "value": 3 },
  "max_rework_attempts": 3
}
